<?xml version="1.0" encoding="UTF-8"?>
<!DOCTYPE proyectoEIA SYSTEM ".\proyectoEIA.dtd">
<proyectoEIA>
	<nombre/>
	<descripcion/>
	<promotor/>
	<redactor/>
	<fecha>
		<dia/>
		<mes/>
		<anio/>
	</fecha>
	<vidaUtil/>
	<poblacion/>
	<provincia/>
	<pais/>
	<listaAlternativas/>
	<listaFactores>
		<factor>
			<nombreFactor>SISTEMA FÍSICO NATURAL</nombreFactor>
			<listaFactores>
				<factor>
					<nombreFactor>Medio abiótico</nombreFactor>
					<listaFactores>
						<factor>
							<nombreFactor>Aire</nombreFactor>
							<listaFactores>
								<factor>
									<nombreFactor>Calidad del aire</nombreFactor>
									<peso>30</peso>
								</factor>
								<factor>
									<nombreFactor> Nivel sonoro</nombreFactor>
									<peso>50</peso>
								</factor>
							</listaFactores>
						</factor>
						<factor>
							<nombreFactor>Geología. Geomorfía</nombreFactor>
							<listaFactores>
								<factor>
									<nombreFactor>Relieve</nombreFactor>
									<peso>25</peso>
								</factor>
								<factor>
									<nombreFactor>Recursos culturales (PIGs)</nombreFactor>
									<peso>15</peso>
								</factor>
							</listaFactores>
						</factor>
						<factor>
							<nombreFactor>Suelos</nombreFactor>
							<listaFactores>
								<factor>
									<nombreFactor>Contaminación del suelo</nombreFactor>
									<peso>20</peso>
								</factor>
								<factor>
									<nombreFactor>Capacidad agrológica del suelo</nombreFactor>
									<peso>20</peso>
								</factor>
							</listaFactores>
						</factor>
						<factor>
							<nombreFactor>Aguas superficiales</nombreFactor>
							<peso>40</peso>
						</factor>
						<factor>
							<nombreFactor>Aguas subterráneas</nombreFactor>
							<peso>30</peso>
						</factor>
					</listaFactores>
				</factor>
				<factor>
					<nombreFactor>Medio biótico</nombreFactor>
					<listaFactores>
						<factor>
							<nombreFactor>Vegetación</nombreFactor>
							<listaFactores>
								<factor>
									<nombreFactor>Formaciones vegetales</nombreFactor>
									<peso>100</peso>
								</factor>
								<factor>
									<nombreFactor>Especies singulares</nombreFactor>
									<peso>20</peso>
								</factor>
							</listaFactores>
						</factor>
						<factor>
							<nombreFactor>Fauna</nombreFactor>
							<peso>120</peso>
						</factor>
					</listaFactores>				
				</factor>
				<factor>
					<nombreFactor>Paisaje</nombreFactor>
					<listaFactores>
						<factor>
							<nombreFactor>Calidad. Unidades de paisaje</nombreFactor>
							<peso>40</peso>
						</factor>
						<factor>
							<nombreFactor>Intervisibilidad</nombreFactor>
							<peso>40</peso>
						</factor>
					</listaFactores>
				</factor>
			</listaFactores>
		</factor>
		<factor>
			<nombreFactor>MEDIO SOCIOECONÓMICO</nombreFactor>
			<listaFactores>
				<factor>
					<nombreFactor>Usos del suelo</nombreFactor>
					<listaFactores>
						<factor>
							<nombreFactor>Usos productivos</nombreFactor>
							<peso>55</peso>
						</factor>
						<factor>
							<nombreFactor> Viario rural</nombreFactor>
							<peso>15</peso>
						</factor>
						<factor>
							<nombreFactor> Usos recreativos</nombreFactor>
							<peso>20</peso>
						</factor>
						<factor>
							<nombreFactor> Conservación de la naturaleza</nombreFactor>
							<peso>40</peso>
						</factor>
					</listaFactores>
				</factor>
				<factor>
					<nombreFactor>Población</nombreFactor>
					<listaFactores>
						<factor>
							<nombreFactor>Empleo</nombreFactor>
							<peso>25</peso>
						</factor>
						<factor>
							<nombreFactor>Calidad de vida</nombreFactor>
							<peso>30</peso>
						</factor>
						<factor>
							<nombreFactor>Aceptación social</nombreFactor>
							<peso>15</peso>
						</factor>
					</listaFactores>
				</factor>
				<factor>
					<nombreFactor>Economía</nombreFactor>
					<peso>40</peso>
				</factor>
				<factor>
					<nombreFactor>Infraestructuras y planeamiento urbanístico</nombreFactor>
					<peso>60</peso>
				</factor>
			</listaFactores>
		</factor>
		<factor>
			<nombreFactor>PATRIMONIO CULTURAL</nombreFactor>
			<listaFactores>
				<factor>
					<nombreFactor>Patrimonio histórico artístico</nombreFactor>
					<peso>55</peso>
				</factor>
				<factor>
					<nombreFactor>Arqueología y paleontología</nombreFactor>
					<peso>45</peso>
				</factor>
			</listaFactores>
		</factor>
		<factor>
			<nombreFactor>PROCESOS</nombreFactor>
			<listaFactores>
				<factor>
					<nombreFactor>Erosión</nombreFactor>
					<peso>20</peso>
				</factor>
				<factor>
					<nombreFactor>Inundación</nombreFactor>
					<peso>10</peso>
				</factor>
				<factor>
					<nombreFactor>Incendios</nombreFactor>
					<peso>20</peso>
				</factor>
			</listaFactores>
		</factor>
	</listaFactores>
</proyectoEIA>
