<?xml version="1.0" encoding="UTF-8" standalone="no"?><!DOCTYPE proyectoEIA SYSTEM "..\plantillas\proyectoEIA.dtd">
<proyectoEIA><nombre>Gravera</nombre><descripcion>IMPACTO AMBIENTAL EN UNA GRAVERA</descripcion><promotor>EIA09 Pruebas</promotor><redactor>Luis &amp; Kike</redactor><fecha><dia>10</dia><mes>01</mes><anio>2009</anio></fecha><vidaUtil>3</vidaUtil><poblacion>Madrid</poblacion><provincia>Madrid</provincia><pais>España</pais><tipo>PERSONALIZADO</tipo><listaAlternativas><alternativaProyEIA><nombreAlt>Alternativa 1</nombreAlt><listaPrincipalAcciones><accion><nombreAccion>Accion 3</nombreAccion></accion><accion><nombreAccion>Accion 2</nombreAccion></accion><accion><nombreAccion>Acción 1</nombreAccion></accion></listaPrincipalAcciones><listaEfectos><efecto><idEfecto>Incremento de ruidos</idEfecto><descripcion>Ruidos de maquinaria</descripcion><caracter>compatible</caracter><idAccion>Acción 1</idAccion><idFactor> Nivel sonoro</idFactor><valorSimpleEnjuiciamiento>significativo</valorSimpleEnjuiciamiento><valorCuantitativo><indicador>435.2</indicador><maxVal>12035.2</maxVal><minVal>0.0</minVal><magnitud>0.036</magnitud></valorCuantitativo><valorCualitativo><signo>-1</signo><acumulacion>3</acumulacion><extension>4</extension><extensionCritica>0</extensionCritica><intensidad>4</intensidad><persistencia>1</persistencia><reversibilidad>1</reversibilidad><recuperabilidad>4</recuperabilidad><periodicidad>0</periodicidad><momento>0</momento><momentoCritico>0</momentoCritico><efectoImp>0</efectoImp><incidencia>-0.344</incidencia></valorCualitativo><valorTotal>-0.619</valorTotal></efecto><efecto><idEfecto>Emisión de polvo y partículas</idEfecto><descripcion>Suciedad emitida por la maquinaria</descripcion><idAccion>Accion 2</idAccion><idFactor>Contaminación del suelo</idFactor><valorSimpleEnjuiciamiento>significativo</valorSimpleEnjuiciamiento></efecto><efecto><idEfecto>Modificación del microclima</idEfecto><descripcion>Por los humos de la maquinaria</descripcion><idAccion>Accion 3</idAccion><idFactor>Relieve</idFactor><valorSimpleEnjuiciamiento>significativo</valorSimpleEnjuiciamiento></efecto></listaEfectos><valorada>false</valorada></alternativaProyEIA></listaAlternativas><listaFactores><factor><nombreFactor>SISTEMA FÍSICO NATURAL</nombreFactor><peso>550</peso><listaFactores><factor><nombreFactor>Medio abiótico</nombreFactor><peso>230</peso><listaFactores><factor><nombreFactor>Aire</nombreFactor><peso>80</peso><listaFactores><factor><nombreFactor>Calidad del aire</nombreFactor><peso>30</peso></factor><factor><nombreFactor> Nivel sonoro</nombreFactor><peso>50</peso></factor></listaFactores></factor><factor><nombreFactor>Geología. Geomorfía</nombreFactor><peso>40</peso><listaFactores><factor><nombreFactor>Relieve</nombreFactor><peso>25</peso></factor><factor><nombreFactor>Recursos culturales (PIGs)</nombreFactor><peso>15</peso></factor></listaFactores></factor><factor><nombreFactor>Suelos</nombreFactor><peso>40</peso><listaFactores><factor><nombreFactor>Contaminación del suelo</nombreFactor><peso>20</peso></factor><factor><nombreFactor>Capacidad agrológica del suelo</nombreFactor><peso>20</peso></factor></listaFactores></factor><factor><nombreFactor>Aguas superficiales</nombreFactor><peso>40</peso></factor><factor><nombreFactor>Aguas subterráneas</nombreFactor><peso>30</peso></factor></listaFactores></factor><factor><nombreFactor>Medio biótico</nombreFactor><peso>240</peso><listaFactores><factor><nombreFactor>Vegetación</nombreFactor><peso>120</peso><listaFactores><factor><nombreFactor>Formaciones vegetales</nombreFactor><peso>100</peso></factor><factor><nombreFactor>Especies singulares</nombreFactor><peso>20</peso></factor></listaFactores></factor><factor><nombreFactor>Fauna</nombreFactor><peso>120</peso></factor></listaFactores></factor><factor><nombreFactor>Paisaje</nombreFactor><peso>80</peso><listaFactores><factor><nombreFactor>Calidad. Unidades de paisaje</nombreFactor><peso>40</peso></factor><factor><nombreFactor>Intervisibilidad</nombreFactor><peso>40</peso></factor></listaFactores></factor></listaFactores></factor><factor><nombreFactor>MEDIO SOCIOECONÓMICO</nombreFactor><peso>300</peso><listaFactores><factor><nombreFactor>Usos del suelo</nombreFactor><peso>130</peso><listaFactores><factor><nombreFactor>Usos productivos</nombreFactor><peso>55</peso></factor><factor><nombreFactor> Viario rural</nombreFactor><peso>15</peso></factor><factor><nombreFactor> Usos recreativos</nombreFactor><peso>20</peso></factor><factor><nombreFactor> Conservación de la naturaleza</nombreFactor><peso>40</peso></factor></listaFactores></factor><factor><nombreFactor>Población</nombreFactor><peso>70</peso><listaFactores><factor><nombreFactor>Empleo</nombreFactor><peso>25</peso></factor><factor><nombreFactor>Calidad de vida</nombreFactor><peso>30</peso></factor><factor><nombreFactor>Aceptación social</nombreFactor><peso>15</peso></factor></listaFactores></factor><factor><nombreFactor>Economía</nombreFactor><peso>40</peso></factor><factor><nombreFactor>Infraestructuras y planeamiento urbanístico</nombreFactor><peso>60</peso></factor></listaFactores></factor><factor><nombreFactor>PATRIMONIO CULTURAL</nombreFactor><peso>100</peso><listaFactores><factor><nombreFactor>Patrimonio histórico artístico</nombreFactor><peso>55</peso></factor><factor><nombreFactor>Arqueología y paleontología</nombreFactor><peso>45</peso></factor></listaFactores></factor><factor><nombreFactor>PROCESOS</nombreFactor><peso>50</peso><listaFactores><factor><nombreFactor>Erosión</nombreFactor><peso>20</peso></factor><factor><nombreFactor>Inundación</nombreFactor><peso>10</peso></factor><factor><nombreFactor>Incendios</nombreFactor><peso>20</peso></factor></listaFactores></factor></listaFactores></proyectoEIA>